[
  {
    "id": "a3b-001",
    "name": "Tropius",
    "set_code": "a3b",
    "pack": "Eevee Grove",
    "type": "Pokémon",
    "subtype": "Grass",
    "stage": "Basic",
    "rarity": "◊◊",
    "ex": false,
    "mega": false,
    "health": 100,
    "points": 1,
    "deckBuilderNr": 797
  },
  {
    "id": "a3b-002",
    "name": "Leafeon",
    "set_code": "a3b",
    "pack": "Eevee Grove",
    "type": "Pokémon",
    "subtype": "Grass",
    "stage": "Stage 1",
    "rarity": "◊◊◊",
    "ex": false,
    "mega": false,
    "health": 90,
    "points": 1,
    "deckBuilderNr": 798
  },
  {
    "id": "a3b-003",
    "name": "Bounsweet",
    "set_code": "a3b",
    "pack": "Eevee Grove",
    "type": "Pokémon",
    "subtype": "Grass",
    "stage": "Basic",
    "rarity": "◊",
    "ex": false,
    "mega": false,
    "health": 60,
    "points": 1,
    "deckBuilderNr": 799
  },
  {
    "id": "a3b-004",
    "name": "Steenee",
    "set_code": "a3b",
    "pack": "Eevee Grove",
    "type": "Pokémon",
    "subtype": "Grass",
    "stage": "Stage 1",
    "rarity": "◊",
    "ex": false,
    "mega": false,
    "health": 80,
    "points": 1,
    "deckBuilderNr": 800
  },
  {
    "id": "a3b-005",
    "name": "Tsareena",
    "set_code": "a3b",
    "pack": "Eevee Grove",
    "type": "Pokémon",
    "subtype": "Grass",
    "stage": "Stage 2",
    "rarity": "◊◊",
    "ex": false,
    "mega": false,
    "health": 140,
    "points": 1,
    "deckBuilderNr": 801
  },
  {
    "id": "a3b-006",
    "name": "Applin",
    "set_code": "a3b",
    "pack": "Eevee Grove",
    "type": "Pokémon",
    "subtype": "Grass",
    "stage": "Basic",
    "rarity": "◊",
    "ex": false,
    "mega": false,
    "health": 40,
    "points": 1,
    "deckBuilderNr": 802
  },
  {
    "id": "a3b-007",
    "name": "Appletun",
    "set_code": "a3b",
    "pack": "Eevee Grove",
    "type": "Pokémon",
    "subtype": "Grass",
    "stage": "Stage 1",
    "rarity": "◊◊",
    "ex": false,
    "mega": false,
    "health": 90,
    "points": 1,
    "deckBuilderNr": 803
  },
  {
    "id": "a3b-008",
    "name": "Flareon",
    "set_code": "a3b",
    "pack": "Eevee Grove",
    "type": "Pokémon",
    "subtype": "Fire",
    "stage": "Stage 1",
    "rarity": "◊◊◊",
    "ex": false,
    "mega": false,
    "health": 110,
    "points": 1,
    "deckBuilderNr": 804
  },
  {
    "id": "a3b-009",
    "name": "Flareon ex",
    "set_code": "a3b",
    "pack": "Eevee Grove",
    "type": "Pokémon",
    "subtype": "Fire",
    "stage": "Stage 1",
    "rarity": "◊◊◊◊",
    "ex": true,
    "mega": false,
    "health": 150,
    "points": 2,
    "deckBuilderNr": 805
  },
  {
    "id": "a3b-010",
    "name": "Torkoal",
    "set_code": "a3b",
    "pack": "Eevee Grove",
    "type": "Pokémon",
    "subtype": "Fire",
    "stage": "Basic",
    "rarity": "◊",
    "ex": false,
    "mega": false,
    "health": 100,
    "points": 1,
    "deckBuilderNr": 806
  },
  {
    "id": "a3b-011",
    "name": "Litten",
    "set_code": "a3b",
    "pack": "Eevee Grove",
    "type": "Pokémon",
    "subtype": "Fire",
    "stage": "Basic",
    "rarity": "◊",
    "ex": false,
    "mega": false,
    "health": 70,
    "points": 1,
    "deckBuilderNr": 807
  },
  {
    "id": "a3b-012",
    "name": "Torracat",
    "set_code": "a3b",
    "pack": "Eevee Grove",
    "type": "Pokémon",
    "subtype": "Fire",
    "stage": "Stage 1",
    "rarity": "◊",
    "ex": false,
    "mega": false,
    "health": 80,
    "points": 1,
    "deckBuilderNr": 808
  },
  {
    "id": "a3b-013",
    "name": "Incineroar",
    "set_code": "a3b",
    "pack": "Eevee Grove",
    "type": "Pokémon",
    "subtype": "Fire",
    "stage": "Stage 2",
    "rarity": "◊◊",
    "ex": false,
    "mega": false,
    "health": 150,
    "points": 1,
    "deckBuilderNr": 809
  },
  {
    "id": "a3b-014",
    "name": "Salandit",
    "set_code": "a3b",
    "pack": "Eevee Grove",
    "type": "Pokémon",
    "subtype": "Fire",
    "stage": "Basic",
    "rarity": "◊",
    "ex": false,
    "mega": false,
    "health": 60,
    "points": 1,
    "deckBuilderNr": 810
  },
  {
    "id": "a3b-015",
    "name": "Salazzle",
    "set_code": "a3b",
    "pack": "Eevee Grove",
    "type": "Pokémon",
    "subtype": "Fire",
    "stage": "Stage 1",
    "rarity": "◊◊",
    "ex": false,
    "mega": false,
    "health": 90,
    "points": 1,
    "deckBuilderNr": 811
  },
  {
    "id": "a3b-016",
    "name": "Vaporeon",
    "set_code": "a3b",
    "pack": "Eevee Grove",
    "type": "Pokémon",
    "subtype": "Water",
    "stage": "Stage 1",
    "rarity": "◊◊◊",
    "ex": false,
    "mega": false,
    "health": 120,
    "points": 1,
    "deckBuilderNr": 812
  },
  {
    "id": "a3b-017",
    "name": "Glaceon",
    "set_code": "a3b",
    "pack": "Eevee Grove",
    "type": "Pokémon",
    "subtype": "Water",
    "stage": "Stage 1",
    "rarity": "◊◊◊",
    "ex": false,
    "mega": false,
    "health": 100,
    "points": 1,
    "deckBuilderNr": 813
  },
  {
    "id": "a3b-018",
    "name": "Vanillite",
    "set_code": "a3b",
    "pack": "Eevee Grove",
    "type": "Pokémon",
    "subtype": "Water",
    "stage": "Basic",
    "rarity": "◊",
    "ex": false,
    "mega": false,
    "health": 60,
    "points": 1,
    "deckBuilderNr": 732
  },
  {
    "id": "a3b-019",
    "name": "Vanillish",
    "set_code": "a3b",
    "pack": "Eevee Grove",
    "type": "Pokémon",
    "subtype": "Water",
    "stage": "Stage 1",
    "rarity": "◊",
    "ex": false,
    "mega": false,
    "health": 80,
    "points": 1,
    "deckBuilderNr": 814
  },
  {
    "id": "a3b-020",
    "name": "Vanilluxe",
    "set_code": "a3b",
    "pack": "Eevee Grove",
    "type": "Pokémon",
    "subtype": "Water",
    "stage": "Stage 2",
    "rarity": "◊◊",
    "ex": false,
    "mega": false,
    "health": 140,
    "points": 1,
    "deckBuilderNr": 815
  },
  {
    "id": "a3b-021",
    "name": "Alomomola",
    "set_code": "a3b",
    "pack": "Eevee Grove",
    "type": "Pokémon",
    "subtype": "Water",
    "stage": "Basic",
    "rarity": "◊",
    "ex": false,
    "mega": false,
    "health": 110,
    "points": 1,
    "deckBuilderNr": 816
  },
  {
    "id": "a3b-022",
    "name": "Popplio",
    "set_code": "a3b",
    "pack": "Eevee Grove",
    "type": "Pokémon",
    "subtype": "Water",
    "stage": "Basic",
    "rarity": "◊",
    "ex": false,
    "mega": false,
    "health": 70,
    "points": 1,
    "deckBuilderNr": 817
  },
  {
    "id": "a3b-023",
    "name": "Brionne",
    "set_code": "a3b",
    "pack": "Eevee Grove",
    "type": "Pokémon",
    "subtype": "Water",
    "stage": "Stage 1",
    "rarity": "◊",
    "ex": false,
    "mega": false,
    "health": 90,
    "points": 1,
    "deckBuilderNr": 818
  },
  {
    "id": "a3b-024",
    "name": "Primarina ex",
    "set_code": "a3b",
    "pack": "Eevee Grove",
    "type": "Pokémon",
    "subtype": "Water",
    "stage": "Stage 2",
    "rarity": "◊◊◊◊",
    "ex": true,
    "mega": false,
    "health": 180,
    "points": 2,
    "deckBuilderNr": 819
  },
  {
    "id": "a3b-025",
    "name": "Jolteon",
    "set_code": "a3b",
    "pack": "Eevee Grove",
    "type": "Pokémon",
    "subtype": "Lightning",
    "stage": "Stage 1",
    "rarity": "◊◊◊",
    "ex": false,
    "mega": false,
    "health": 90,
    "points": 1,
    "deckBuilderNr": 733
  },
  {
    "id": "a3b-026",
    "name": "Joltik",
    "set_code": "a3b",
    "pack": "Eevee Grove",
    "type": "Pokémon",
    "subtype": "Lightning",
    "stage": "Basic",
    "rarity": "◊",
    "ex": false,
    "mega": false,
    "health": 40,
    "points": 1,
    "deckBuilderNr": 820
  },
  {
    "id": "a3b-027",
    "name": "Galvantula",
    "set_code": "a3b",
    "pack": "Eevee Grove",
    "type": "Pokémon",
    "subtype": "Lightning",
    "stage": "Stage 1",
    "rarity": "◊◊",
    "ex": false,
    "mega": false,
    "health": 80,
    "points": 1,
    "deckBuilderNr": 821
  },
  {
    "id": "a3b-028",
    "name": "Espeon",
    "set_code": "a3b",
    "pack": "Eevee Grove",
    "type": "Pokémon",
    "subtype": "Psychic",
    "stage": "Stage 1",
    "rarity": "◊◊◊",
    "ex": false,
    "mega": false,
    "health": 100,
    "points": 1,
    "deckBuilderNr": 822
  },
  {
    "id": "a3b-029",
    "name": "Woobat",
    "set_code": "a3b",
    "pack": "Eevee Grove",
    "type": "Pokémon",
    "subtype": "Psychic",
    "stage": "Basic",
    "rarity": "◊",
    "ex": false,
    "mega": false,
    "health": 60,
    "points": 1,
    "deckBuilderNr": 823
  },
  {
    "id": "a3b-030",
    "name": "Swoobat",
    "set_code": "a3b",
    "pack": "Eevee Grove",
    "type": "Pokémon",
    "subtype": "Psychic",
    "stage": "Stage 1",
    "rarity": "◊◊",
    "ex": false,
    "mega": false,
    "health": 100,
    "points": 1,
    "deckBuilderNr": 824
  },
  {
    "id": "a3b-031",
    "name": "Swirlix",
    "set_code": "a3b",
    "pack": "Eevee Grove",
    "type": "Pokémon",
    "subtype": "Psychic",
    "stage": "Basic",
    "rarity": "◊",
    "ex": false,
    "mega": false,
    "health": 60,
    "points": 1,
    "deckBuilderNr": 825
  },
  {
    "id": "a3b-032",
    "name": "Slurpuff",
    "set_code": "a3b",
    "pack": "Eevee Grove",
    "type": "Pokémon",
    "subtype": "Psychic",
    "stage": "Stage 1",
    "rarity": "◊◊",
    "ex": false,
    "mega": false,
    "health": 120,
    "points": 1,
    "deckBuilderNr": 826
  },
  {
    "id": "a3b-033",
    "name": "Sylveon",
    "set_code": "a3b",
    "pack": "Eevee Grove",
    "type": "Pokémon",
    "subtype": "Psychic",
    "stage": "Stage 1",
    "rarity": "◊◊◊",
    "ex": false,
    "mega": false,
    "health": 90,
    "points": 1,
    "deckBuilderNr": 827
  },
  {
    "id": "a3b-034",
    "name": "Sylveon ex",
    "set_code": "a3b",
    "pack": "Eevee Grove",
    "type": "Pokémon",
    "subtype": "Psychic",
    "stage": "Stage 1",
    "rarity": "◊◊◊◊",
    "ex": true,
    "mega": false,
    "health": 140,
    "points": 2,
    "deckBuilderNr": 828
  },
  {
    "id": "a3b-035",
    "name": "Mimikyu",
    "set_code": "a3b",
    "pack": "Eevee Grove",